{
  "experiment_id": "g900-shell-bulk-v1",
  "model_id": "G900",
  "run_id": "RUN_001",
  "root_id": "ROOT_001",
  "index_mode": "shell",
  "shell_scale_definition": "S_k = empirical shell envelope, currently set equal to observed shell occupancy for this first-light run",
  "bulk_scale_definition": "C_k = cumulative observed occupancy through shell k",
  "rows": [
    {
      "index": 0,
      "occupancy": 1,
      "shell_capacity": 1,
      "bulk_capacity": 1,
      "shell_density": 1.0,
      "bulk_density": 1.0,
      "density_difference": 0.0,
      "density_ratio": 1.0,
      "notes": ""
    },
    {
      "index": 1,
      "occupancy": 4,
      "shell_capacity": 4,
      "bulk_capacity": 5,
      "shell_density": 1.0,
      "bulk_density": 0.8,
      "density_difference": 0.19999999999999996,
      "density_ratio": 1.25,
      "notes": ""
    },
    {
      "index": 2,
      "occupancy": 8,
      "shell_capacity": 8,
      "bulk_capacity": 13,
      "shell_density": 1.0,
      "bulk_density": 0.6153846153846154,
      "density_difference": 0.3846153846153846,
      "density_ratio": 1.625,
      "notes": ""
    },
    {
      "index": 3,
      "occupancy": 16,
      "shell_capacity": 16,
      "bulk_capacity": 29,
      "shell_density": 1.0,
      "bulk_density": 0.5517241379310345,
      "density_difference": 0.4482758620689655,
      "density_ratio": 1.8125,
      "notes": ""
    },
    {
      "index": 4,
      "occupancy": 24,
      "shell_capacity": 24,
      "bulk_capacity": 53,
      "shell_density": 1.0,
      "bulk_density": 0.4528301886792453,
      "density_difference": 0.5471698113207547,
      "density_ratio": 2.2083333333333335,
      "notes": ""
    },
    {
      "index": 5,
      "occupancy": 6,
      "shell_capacity": 6,
      "bulk_capacity": 59,
      "shell_density": 1.0,
      "bulk_density": 0.1016949152542373,
      "density_difference": 0.8983050847457628,
      "density_ratio": 9.833333333333332,
      "notes": ""
    },
    {
      "index": 6,
      "occupancy": 1,
      "shell_capacity": 1,
      "bulk_capacity": 60,
      "shell_density": 1.0,
      "bulk_density": 0.016666666666666666,
      "density_difference": 0.9833333333333333,
      "density_ratio": 60.0,
      "notes": ""
    }
  ]
}
